{
  "$schema": "https://json-schema.org/draft/2020-12/schema",
  "$id": "https://greenwood.local/schemas/enemy.json",
  "title": "Greenwood enemy template",
  "type": "object",
  "additionalProperties": false,
  "required": [
    "id",
    "name",
    "shortDescription",
    "examineDescription",
    "maxHealth",
    "attack",
    "experience"
  ],
  "properties": {
    "$schema": {
      "type": "string"
    },
    "id": {
      "type": "string",
      "pattern": "^[a-z][a-z0-9-]*$"
    },
    "name": {
      "type": "string",
      "minLength": 1
    },
    "shortDescription": {
      "type": "string",
      "minLength": 1
    },
    "examineDescription": {
      "type": "string",
      "minLength": 1
    },
    "lookDescription": {
      "type": "string",
      "minLength": 1
    },
    "maxHealth": {
      "type": "integer",
      "minimum": 1
    },
    "maxFocus": {
      "type": "integer",
      "minimum": 0
    },
    "attack": {
      "type": "integer",
      "minimum": 1
    },
    "experience": {
      "type": "integer",
      "minimum": 0
    },
    "minParty": {
      "type": "integer",
      "minimum": 1
    },
    "loot": {
      "type": "array",
      "items": {
        "type": "string",
        "pattern": "^[a-z][a-z0-9-]*$"
      }
    },
    "victoryNarration": {
      "type": "string",
      "minLength": 1
    },
    "lockNarration": {
      "type": "string",
      "minLength": 1,
      "description": "Spoken on combat.turn_started after the first lock (round > 1). Dummy stays quiet."
    },
    "reads": {
      "type": "array",
      "minItems": 1,
      "maxItems": 6,
      "items": {
        "type": "string",
        "enum": ["lunge", "brace", "gather"]
      },
      "description": "Cycle of foe beats. The card states the current read before the lock."
    }
  }
}
