{
  "$schema": "../schemas/enemy.schema.json",
  "id": "silk-hatchling",
  "name": "Silk Hatchling",
  "shortDescription": "A silk-child that woke too early and will not wait.",
  "lookDescription": "A pale hatchling, no larger than a satchel, clicking among the opened husks.",
  "examineDescription": "The Silk Hatchling is the size of a school satchel. Its legs are still soft, but the mandibles already click like a practice stick. Piper is afraid of it for a reason. Finish it. It is not a queen, and it should not get back up.",
  "maxHealth": 10,
  "maxFocus": 8,
  "attack": 3,
  "experience": 8,
  "loot": ["torn-silk-strand"],
  "lockNarration": "Silk pulls tighter around the husk.",
  "victoryNarration": "The Silk Hatchling goes still. The opened husk stays sweet. It is not a queen, and it is not Holm."
}
