{
  "$schema": "../schemas/enemy.schema.json",
  "id": "mist-crow",
  "name": "Mist Crow",
  "shortDescription": "A wet black bird too large for a rook, fog in the feathers.",
  "lookDescription": "A wet black bird too large for a rook sits the fold rail, fog in the feathers.",
  "examineDescription": "The Mist Crow is bigger than an honest rook. Its feathers hold fog the way wool holds rain. It watches the empty fold as if it paid rent. Solo work. If it squares up, finish it, then talk Wren.",
  "maxHealth": 12,
  "attack": 3,
  "experience": 10,
  "lockNarration": "Fog beads on the feathers and does not shake off.",
  "victoryNarration": "The Mist Crow comes apart into wet feathers and thinner fog. The fold rail is only wood again."
}
