{
  "$schema": "../schemas/enemy.schema.json",
  "id": "rope-sentry",
  "name": "Rope Sentry",
  "shortDescription": "A thief posted to keep the cut painter cut.",
  "lookDescription": "A badger in a river coat stands on the rope-island with a cut line in one paw.",
  "examineDescription": "A grown badger in an oiled river coat, posted on the island with a cut rope-end still in one paw. His job was to keep the landing knot cut. The whistle on the heron post is the thing he was posted to stop anyone hearing.",
  "maxHealth": 32,
  "attack": 6,
  "experience": 12,
  "loot": ["cut-rope"],
  "lockNarration": "The cut rope tightens in a paw that is not yours.",
  "victoryNarration": "The Rope Sentry leaves the island to the ropes. The cut end stays in the mud."
}
