{
  "$schema": "../schemas/enemy.schema.json",
  "id": "reed-wisp",
  "name": "Reed Wisp",
  "shortDescription": "A low light on the mere that does not warm the hands.",
  "lookDescription": "A low light sits on the mere and does not warm the hands.",
  "examineDescription": "A low green light about a paw's width across, sitting on the water with nothing under it holding it up. Shout near it and your voice comes back thinner, or not at all. Do not drink the mere.",
  "maxHealth": 26,
  "attack": 5,
  "experience": 10,
  "loot": ["wisp-glass"],
  "lockNarration": "The light tightens and the mere goes quieter.",
  "victoryNarration": "The Reed Wisp goes out. The mere is only water, cold and ordinary."
}
