{
  "$schema": "../schemas/enemy.schema.json",
  "id": "race-pike",
  "name": "Race Pike",
  "shortDescription": "A long hunger in the mill-race that is not a student.",
  "lookDescription": "A long dark shape holds the mill-race and does not blink like a fish should.",
  "examineDescription": "A pike as long as your arm, holding station in the fastest part of the race without appearing to work at it. Its eye tracks you along the bank. If you only came for the osiers, leave it alone. If it will not let the water run, it will fight.",
  "maxHealth": 24,
  "attack": 5,
  "experience": 8,
  "loot": ["river-stone"],
  "lockNarration": "The race flattens, as if something wide had decided to stay.",
  "victoryNarration": "The Race Pike slips under ordinary water. A smooth stone knocks the piling."
}
