{
  "$schema": "../schemas/enemy.schema.json",
  "id": "ditch-lurker",
  "name": "Ditch Lurker",
  "shortDescription": "Peat and iron that learned to wait in black water.",
  "lookDescription": "Something peat-dark waits in the ditch, the size of a satchel, and does not swim away.",
  "examineDescription": "The Ditch Lurker is peat and old iron, not a fish and not a person. It keeps shine. It is not the abbey bronze. Solo work.",
  "maxHealth": 36,
  "attack": 6,
  "experience": 14,
  "loot": ["ditch-nail"],
  "lockNarration": "Black water climbs the ditch lip and does not spill.",
  "victoryNarration": "The Ditch Lurker sinks into ordinary mud. The nail is all it kept."
}
